Male, Violet, Porsche, FALSE, 4/5/2018 00:31, 36, 0.06, 73277
Female, Crimson, Lexus, FALSE, 11/12/2022 02:53, 46, 0.02, 42344
Female, Turquoise, Lincoln, TRUE, 2/28/2019 21:55, 60, 0.07, 52928
Female, Indigo, Volvo, FALSE, 5/12/2022 02:37, 29, 0.23, 56351
Female, Goldenrod, Mercedes-Benz, TRUE, 7/12/2018 12:48, 59, 0.42, 46592
Female, Puce, Mercury, FALSE, 10/5/2022 13:13, 29, 0.44, 27801
Male, Aquamarine, Mitsubishi, TRUE, 4/12/2020 02:16, 31, 0.15, 69657
Female, Yellow, Chevrolet, TRUE, 3/14/2020 22:02, 55, 0.11, 34379
Female, Crimson, Ford, FALSE, 6/1/2020 23:11, 56, 0.29,
Male, Maroon, Ford, FALSE, 9/1/2021 11:26, 58, , 65962
Male, Crimson, Saab, TRUE, 4/19/2022 11:07, 22, 0.03, 59205
Male, Fuscia, Ford, TRUE, 5/11/2018 02:50, 20, 0.28, 30866
Female, Pink, Volvo, TRUE, 2/8/2019 18:58, 28, 0.43, 45977
Female, Yellow, Volkswagen, TRUE, 6/21/2018 22:36, 47, 0.34, 42334
Agender, Mauv, Dodge, TRUE, 12/23/2021 05:41, 40, 0.21, 10691
Female, Turquoise, BMW, TRUE, 2/1/2020 05:14, 53, 0.32, 19117
Female, Purple, Ford, FALSE, 6/25/2021 12:51, 60, 0.38, 35197
Male, Blue, Mitsubishi, FALSE, 12/14/2018 03:43, 37, 0.41, 50131
Female, Puce, Cadillac, FALSE, 5/8/2019 00:49, 42, 0.42, 59126
Male, Khaki, Acura, FALSE, 8/14/2021 05:50, 37, 0.5, 67054
Male, Fuscia, Subaru, TRUE, 6/13/2018 16:15, 64, 0.19, 62432
Male, Puce, Geo, TRUE, 11/6/2020 12:07, 37, 0.14, 29449
Male, Aquamarine, Nissan, TRUE, 2/14/2022 18:46, 45, 0.43, 15940
Male, Crimson, Honda, FALSE, 4/6/2019 03:27, 63, 0.21, 56677
Male, Green, Ford, FALSE, 10/10/2018 11:37, , 0.39, 59191
Female, Red, Buick, TRUE, 2/16/2022 17:30, 37, 0.41, 32474
Female, Indigo, Nissan, FALSE, 6/29/2022 16:23, 50, 0.23, 28900
Female, Green, Hillman, TRUE, 7/14/2022 09:12, 20, 0.39, 38522
Genderfluid, Maroon, Chevrolet, FALSE, 4/3/2019 00:30, 60, 0.36, 73053
Male, Red, Ford, TRUE, 12/10/2022 09:28, 21, 0.16, 49814
Male, Fuscia, Infiniti, FALSE, 1/18/2021 17:57, 59, 0.42, 10250
Genderqueer, Teal, Toyota, FALSE, 4/25/2020 00:35, 56, 0.25, 38695
Female, Pink, Dodge, FALSE, 5/26/2019 01:33, 53, 0.48, 28926
Female, Purple, Mazda, TRUE, 5/21/2021 02:22, 43, 0.09, 14132
Female, Khaki, Kia, FALSE, 7/27/2019 06:24, 21, 0.4, 37713
Bigender, Violet, Jaguar, TRUE, 1/9/2018 11:23, 65, 0.35, 62582
Female, Teal, Cadillac, TRUE, 10/8/2020 06:59, 64, 0.3, 31419
Female, Green, Ford, TRUE, 11/22/2019 03:26, 42, 0.34, 42969
Male, Teal, Chevrolet, FALSE, 5/24/2019 23:42, 51, 0.38, 31520
Male, Crimson, , TRUE, 2/23/2018 02:15, 31, 0.22, 63053
Female, Fuscia, Buick, FALSE, 5/15/2022 04:53, 41, 0.21, 32004
Genderfluid, Blue, Volkswagen, TRUE, 7/28/2019 01:22, 22, 0.07, 47734
Female, , Pontiac, TRUE, 3/20/2018 23:35, 62, 0.46, 57185
Genderfluid, Pink, Toyota, TRUE, , 23, 0.06, 50697
Female, Orange, Porsche, FALSE, 9/21/2019 05:12, 65, 0.36, 44755
Male, Turquoise, Mazda, FALSE, 8/26/2020 17:52, 62, 0.13, 64958
Female, Aquamarine, GMC, FALSE, 6/5/2019 08:10, 35, 0.09, 60895
Female, Turquoise, Studebaker, TRUE, 5/17/2018 21:34, 27, 0.41, 16787
Female, Crimson, Chevrolet, FALSE, 6/19/2020 06:28, 32, 0.24, 70447
Female, Puce, Dodge, FALSE, 5/19/2022 22:07, 60, 0.07, 32732
Non-binary, Yellow, Ford, FALSE, 4/16/2019 19:22, 41, 0.03, 70932
Male, Turquoise, Volvo, TRUE, 9/2/2022 18:43, 26, 0.15, 32235
Female, Violet, Lexus, FALSE, 3/1/2019 02:49, 58, , 58212
Male, Red, Chevrolet, FALSE, 11/26/2021 15:50, 57, 0.39, 27968
Male, Maroon, Toyota, TRUE, 3/1/2022 01:12, 47, 0.3, 35164
Genderqueer, Mauv, Toyota, FALSE, 9/17/2021 12:52, 58, 0.17, 21127
Female, Puce, Chevrolet, TRUE, 11/29/2022 05:03, 36, 0.26, 44556
Female, Orange, Mercedes-Benz, TRUE, 1/3/2021 15:03, 55, 0.41, 65066
Female, Crimson, GMC, FALSE, 7/27/2018 08:38, 49, 0.38, 58657
Female, Khaki, Pontiac, FALSE, 6/11/2019 18:12, 44, 0.37, 22404
Male, Khaki, Chevrolet, FALSE, 9/10/2018 12:02, 61, 0.22, 39645
Male, Purple, Infiniti, TRUE, , 28, 0.08, 33751
Female, Goldenrod, Chevrolet, FALSE, 4/7/2021 02:26, 55, 0.36, 22080
Male, Maroon, Buick, TRUE, 2/3/2020 05:27, 20, 0.42, 64558
Female, Turquoise, GMC, FALSE, 4/2/2022 20:30, 42, 0.44, 42908
Female, Teal, Dodge, TRUE, 7/4/2020 18:39, 23, 0.36, 19762
Female, Crimson, Saab, TRUE, 8/20/2018 20:12, 24, 0.46, 30030
Female, Blue, Lexus, FALSE, 5/24/2018 12:52, 23, 0.33, 34523
Male, Green, Chevrolet, FALSE, 1/6/2022 20:42, 65, 0.14, 19370
Male, Red, Toyota, TRUE, 5/21/2020 00:15, 29, 0.34, 34259
Female, Goldenrod, GMC, TRUE, 8/10/2022 06:34, 59, 0.06, 45052
Male, Yellow, Mercedes-Benz, FALSE, 4/25/2018 00:32, 47, 0.31, 20907
Female, Fuscia, Lexus, FALSE, 1/28/2020 02:49, 21, 0.07, 26219
Female, Turquoise, Ford, FALSE, 4/9/2022 15:01, 55, 0.11, 35885
Female, Purple, Toyota, FALSE, 3/5/2022 17:40, 30, 0.21, 65073
Female, Purple, Hyundai, FALSE, 2/23/2020 13:03, 65, 0.35, 67185
Male, Violet, Buick, TRUE, 2/28/2019 12:30, 45, 0.05, 51336
Male, Violet, Ford, FALSE, 11/12/2019 21:24, 58, 0.32, 45701
Female, Goldenrod, Honda, FALSE, 1/23/2022 12:36, 35, 0.25, 22847
Agender, Green, Chevrolet, FALSE, 6/22/2022 10:38, 40, 0.28, 53999
Female, Blue, BMW, TRUE, 9/16/2020 22:34, 39, 0.44, 19555
Female, Violet, Jaguar, FALSE, 11/15/2021 15:02, 56, 0.16, 23396
Female, Teal, Ford, FALSE, 6/10/2021 14:29, 63, 0.35, 43968
Male, Indigo, Pontiac, TRUE, 11/21/2020 20:36, 39, 0.11, 59409
Male, Orange, Daewoo, FALSE, 6/21/2022 13:39, 30, 0.49, 44309
Genderfluid, Turquoise, Chrysler, TRUE, 7/9/2018 05:46, 31, 0.23, 59281
Female, Blue, Ford, FALSE, 11/7/2020 12:16, 25, 0.09, 34221
Female, Teal, Mazda, TRUE, 8/7/2022 16:48, 26, 0.39, 62344
Female, Aquamarine, Mercedes-Benz, TRUE, 5/18/2021 11:40, 50, 0.4, 38678
Male, Violet, Hyundai, , 6/5/2018 10:43, 44, 0.29, 65949
Female, Red, Chevrolet, FALSE, 7/20/2020 03:58, 34, 0.14, 30378
Female, Yellow, Hyundai, TRUE, 2/23/2018 07:21, 48, 0.27, 39132
Male, Turquoise, Pontiac, FALSE, 7/14/2018 22:16, 54, 0.28,
Polygender, Violet, GMC, TRUE, 6/15/2019 14:33, 56, 0.36, 42743
Male, Pink, Ford, FALSE, 5/3/2020 23:37, 61, 0.03, 62219
Female, Fuscia, Mazda, FALSE, 1/20/2018 15:42, 21, 0.06, 36076
Female, Puce, Plymouth, FALSE, 6/23/2022 20:16, 44, 0.43, 33213
Genderfluid, Fuscia, Ford, FALSE, 2/24/2022 23:49, 53, 0.3, 19673
Female, Crimson, Buick, TRUE, 3/5/2019 00:13, 41, 0.32, 40991
Male, Teal, Infiniti, FALSE, 8/19/2022 09:14, 54, 0.3, 44403
Male, Goldenrod, Toyota, TRUE, 10/20/2018 15:56, 49, 0.15, 27126
Female, Khaki, Acura, FALSE, 8/10/2018 18:21, 31, 0.43, 62854
Male, Yellow, Maserati, FALSE, 10/10/2018 22:05, 50, 0.34, 39316
Female, Blue, Saab, TRUE, 4/2/2019 12:44, 64, 0.16, 41933
Male, Khaki, Toyota, TRUE, 10/19/2022 22:34, 35, 0.23, 30947
Male, Violet, MG, TRUE, 10/31/2019 01:54, 60, 0.37, 46504
Male, Goldenrod, Chevrolet, FALSE, 4/26/2022 12:44, 20, 0.42, 13263
Male, Khaki, Volkswagen, TRUE, 12/27/2022 04:09, 43, 0.32, 61551
Male, Purple, Mercury, FALSE, 8/26/2021 10:17, 53, 0.37, 62484
Female, Pink, Plymouth, TRUE, 10/3/2021 11:47, 51, 0.46, 72772
Male, Mauv, Honda, FALSE, 4/1/2019 22:27, 39, 0.47, 56335
Female, Green, , TRUE, 3/25/2020 03:57, 41, 0.06, 61577
Female, Aquamarine, Ford, FALSE, 3/21/2018 01:46, 25, 0.27, 23393
Male, Indigo, Volkswagen, TRUE, 1/11/2019 02:54, 34, 0.27, 65141
Female, Khaki, Bentley, TRUE, 8/12/2019 15:03, 49, 0.11, 54932
Female, Purple, Jeep, FALSE, 8/16/2020 02:09, 41, 0.34, 24114
Male, Pink, Dodge, TRUE, 11/20/2021 23:20, 48, 0.26, 41699
Male, Khaki, Lotus, TRUE, 9/28/2019 22:29, 58, 0.21, 60863
Female, Green, Mercury, FALSE, 1/15/2019 01:12, 32, 0.27, 52360
Male, Orange, Dodge, TRUE, 5/24/2019 22:20, 50, 0.06, 70024
Female, Green, Nissan, TRUE, 8/10/2021 01:14, 22, 0.32, 30483
Female, Pink, Maybach, TRUE, 3/26/2019 23:00, 44, 0.37, 32039
Male, Violet, Nissan, FALSE, 9/8/2020 20:00, 36, 0.23, 57071
Female, Goldenrod, Audi, TRUE, 10/10/2018 10:56, 28, 0.38, 66514
Female, Yellow, BMW, TRUE, 8/16/2022 04:22, 24, 0.15, 63277
Female, Yellow, Nissan, FALSE, 11/14/2018 13:05, 31, 0.15, 22011
Female, Aquamarine, Ford, TRUE, 5/14/2022 12:48, 46, 0.4, 37815
Female, Yellow, Mercedes-Benz, TRUE, 7/25/2018 14:57, 32, 0.25, 62215
Male, Khaki, GMC, FALSE, 8/6/2018 18:22, 51, 0.08, 62738
Female, Yellow, Land Rover, FALSE, 3/12/2020 21:03, 30, 0.42, 28117
Male, Puce, Alfa Romeo, FALSE, 9/23/2019 04:06, 46, 0.43, 26003
Male, Green, Jaguar, TRUE, 5/30/2022 12:40, 60, 0.1, 32294
Female, Blue, Honda, TRUE, 5/21/2020 13:44, 26, 0.04, 15896
Female, Indigo, Chevrolet, TRUE, 4/12/2021 19:51, 51, 0.45, 45689
Female, Orange, Dodge, TRUE, 10/18/2021 00:43, 61, 0.13, 47621
Female, Maroon, Land Rover, TRUE, 8/5/2019 11:14, 61, 0, 10202
Male, Indigo, Dodge, FALSE, 1/3/2021 15:50, 48, 0.07, 31552
Male, Green, Chevrolet, FALSE, 5/7/2021 15:59, 29, 0.28, 40009
Female, Green, Hyundai, TRUE, 5/25/2020 09:06, 21, 0.32, 68004
Female, Teal, Ford, FALSE, 3/1/2018 05:16, 38, 0.3, 13526
Agender, Yellow, Saab, FALSE, 12/17/2018 07:02, 65, 0.43, 27283
Female, Orange, Mazda, TRUE, 1/23/2021 17:21, 56, 0.34, 65757
Female, Puce, Hyundai, TRUE, 1/17/2020 10:15, 62, 0.24, 49542
Male, Teal, Suzuki, TRUE, 11/20/2021 13:23, 60, 0.18, 31342
Male, Puce, Toyota, TRUE, 4/20/2019 23:06, 64, 0.02, 12999
Polygender, Turquoise, Mazda, TRUE, 12/6/2021 11:00, 56, 0.22, 61289
Genderfluid, Crimson, GMC, TRUE, 5/29/2021 04:26, 25, 0.16, 18574
Male, Goldenrod, , FALSE, 11/28/2021 19:59, 24, 0.39, 39344
Female, Khaki, Mercedes-Benz, TRUE, 12/24/2022 09:55, 54, 0.31, 32487
Female, Khaki, Isuzu, FALSE, 3/10/2018 01:00, 57, 0.26, 26947
Male, Violet, Chrysler, TRUE, 10/18/2022 11:45, 57, 0.43, 32011
Agender, Red, Mercedes-Benz, FALSE, 1/29/2018 23:44, 56, 0.25, 14230
Male, Blue, Land Rover, FALSE, 9/24/2019 18:08, 57, 0.19, 18202
, Aquamarine, MINI, TRUE, 6/27/2020 10:07, 35, 0.3, 20806
Male, Yellow, Volkswagen, FALSE, 12/2/2021 11:12, 25, 0.24, 51489
Female, Mauv, GMC, FALSE, 10/11/2020 21:33, 46, 0.13, 56827
Genderfluid, Maroon, Mazda, FALSE, 12/22/2020 23:42, 31, 0.3, 59424
Male, Red, Mercedes-Benz, FALSE, 11/27/2020 13:42, 21, 0.34, 22689
Male, Puce, Mercedes-Benz, TRUE, 5/5/2018 16:08, , 0.26, 43357
Female, Fuscia, Ford, TRUE, 1/11/2020 19:43, 42, 0.38, 30487
Female, Aquamarine, Nissan, FALSE, 4/21/2021 23:31, 47, 0.13, 24485
Genderfluid, Aquamarine, Jaguar, FALSE, 11/22/2018 11:00, 47, 0.2, 59992
Female, Khaki, Audi, FALSE, 4/18/2021 10:04, 65, 0.47, 52248
Female, Aquamarine, Infiniti, TRUE, 1/7/2021 08:58, 24, 0.04, 63480
Female, Maroon, Mercury, FALSE, 1/3/2021 22:14, 30, 0.31, 23399
Male, Orange, Mazda, FALSE, 3/31/2020 21:47, 26, 0.21, 38653
Agender, Blue, Toyota, FALSE, 4/16/2022 00:04, 64, 0.35, 45078
Female, Maroon, Mercedes-Benz, TRUE, 7/16/2021 09:02, 25, 0.38, 36644
Bigender, Yellow, Buick, FALSE, 9/8/2022 08:23, 24, 0.25, 74488
Male, Indigo, Toyota, TRUE, 8/14/2022 04:26, 46, 0.25, 18731
Male, Blue, Ford, FALSE, 3/11/2019 19:28, 53, 0.21, 69356
Male, Maroon, Mitsubishi, FALSE, 12/9/2019 06:47, 33, 0.46, 28291
Female, Pink, Toyota, TRUE, 8/16/2020 08:31, 51, 0.35, 42663
Male, Green, Buick, FALSE, 8/28/2020 08:05, 45, 0.13, 57951
Genderfluid, Teal, Kia, TRUE, 4/22/2021 19:19, 27, 0.29, 44295
Male, Mauv, Mercedes-Benz, FALSE, 1/31/2021 14:06, 22, 0.07, 26514
Bigender, Fuscia, Audi, TRUE, 1/24/2018 16:20, 42, 0.44, 16641
Female, Crimson, Chevrolet, FALSE, 4/20/2021 22:57, 37, 0.38, 43140
Male, Fuscia, Ford, FALSE, 8/23/2021 02:04, 40, 0.23, 42722
Male, Violet, Mercedes-Benz, FALSE, 7/29/2022 17:05, 55, 0.24, 46382
Female, Blue, Chevrolet, FALSE, 9/2/2022 00:57, 54, 0.38, 67485
Female, , Cadillac, TRUE, 7/24/2018 09:20, 63, 0.32, 53362
Male, Green, Chevrolet, FALSE, 3/22/2020 12:28, 51, 0.02, 57395
Male, Green, MINI, TRUE, 10/30/2018 00:17, 21, 0.2, 54115
Male, Violet, Subaru, FALSE, 11/26/2018 07:45, 41, 0.2, 70143
Female, Green, Mercedes-Benz, FALSE, 5/22/2019 11:06, 37, 0.44, 23312
Female, Pink, Dodge, TRUE, 2/23/2018 03:12, 46, 0.43, 25559
Genderqueer, Blue, Mazda, TRUE, 2/4/2019 17:41, 34, 0.35, 51521
Male, Yellow, Ford, FALSE, 7/19/2018 22:22, 39, 0.32, 24209
Female, Purple, Infiniti, FALSE, 1/28/2018 12:41, 41, 0.47, 43043
Female, Mauv, Nissan, FALSE, 9/3/2021 22:01, 34, 0.09, 12330
Male, Orange, Honda, TRUE, 8/8/2021 16:46, 64, 0.31, 51063
Female, Violet, Honda, FALSE, 3/16/2020 13:16, 44, 0.45, 31197
Male, Fuscia, GMC, FALSE, 10/20/2021 06:15, 46, 0.07, 22601
Female, Pink, Ford, FALSE, 1/9/2020 06:10, 60, 0.21, 19755
Female, Crimson, Porsche, FALSE, 4/12/2019 18:55, 23, 0.47, 35614
Male, Khaki, Mitsubishi, FALSE, 5/23/2018 04:19, 51, 0.01, 73938
Agender, Aquamarine, Bentley, TRUE, 4/17/2020 12:49, 22, 0.3, 35889
Male, Goldenrod, Lincoln, FALSE, 11/23/2022 22:59, 59, 0.33, 65517
Female, Turquoise, Acura, FALSE, 7/27/2021 20:25, 50, 0.31, 40481
Male, Crimson, Honda, FALSE, 9/9/2018 16:08, 54, 0.05, 51225
Male, Turquoise, Subaru, TRUE, 11/26/2020 17:12, 29, 0.28, 12506
Female, Crimson, Mitsubishi, FALSE, 9/27/2019 09:40, 47, 0.15, 73798
Male, Khaki, Lotus, TRUE, 5/16/2022 08:31, 34, 0.38, 41725
Polygender, Mauv, Ford, FALSE, 8/24/2022 17:03, 56, 0.42, 26578
Male, Indigo, Volvo, FALSE, 9/9/2022 00:18, 25, 0.27, 27225
Female, Turquoise, Dodge, TRUE, 11/19/2020 12:53, 41, 0.41, 50829
Male, Violet, Honda, FALSE, 9/23/2018 04:21, 47, 0.01, 20320
Male, Yellow, Nissan, TRUE, 3/10/2021 09:27, 55, 0.16, 36250
Male, Purple, Lincoln, TRUE, 1/15/2018 09:18, 26, 0.46, 16120
Female, Khaki, Nissan, TRUE, 6/7/2018 05:34, 39, 0.37, 21259
Female, Green, Honda, TRUE, 5/23/2022 01:04, 22, 0.42, 52953
Male, Purple, Lotus, FALSE, 10/9/2021 00:09, 55, 0.22, 56770
Male, Crimson, Nissan, FALSE, 4/19/2021 12:20, 38, 0.45, 66497
Male, Puce, Mitsubishi, TRUE, 10/23/2020 17:01, 39, 0.03, 64873
Female, , Nissan, FALSE, 8/26/2019 14:59, 26, 0.47, 34780
Female, Red, Eagle, TRUE, 3/16/2018 20:07, 56, 0.27, 25437
Male, Teal, Jaguar, TRUE, 7/4/2019 11:30, 22, 0.04, 48279
Polygender, Yellow, Buick, FALSE, 8/21/2021 20:59, 25, 0.22, 25298
Male, Mauv, Toyota, FALSE, 3/18/2020 19:15, 26, 0.38, 39537
Male, Maroon, GMC, TRUE, 5/3/2018 23:22, 29, 0.35, 44419
Female, Red, Volkswagen, FALSE, 12/5/2018 06:13, , 0.23, 68847
Female, Pink, Ford, FALSE, 10/26/2018 06:20, 50, 0.35, 51385
Male, Puce, Hyundai, FALSE, 2/17/2022 00:23, 45, 0.4, 60535
Female, Maroon, GMC, TRUE, 4/24/2018 16:18, 33, 0.44, 50428
Male, Blue, Honda, TRUE, 10/19/2018 00:10, 36, 0.3, 69287
Female, Pink, Buick, FALSE, 2/8/2021 01:52, 32, 0.47, 13728
Female, Yellow, Acura, FALSE, 9/28/2021 08:21, 28, 0.24, 47907
Male, Pink, Mercury, FALSE, 5/14/2022 10:34, 21, 0.29, 25956
Female, Crimson, Mazda, TRUE, 9/27/2019 06:07, 24, 0.18, 35413
Female, Teal, Pontiac, FALSE, 8/20/2020 06:03, 59, 0.49, 46409
Female, Puce, Ford, FALSE, 1/21/2018 22:59, 54, 0.39, 11850
Female, Teal, Suzuki, TRUE, 5/23/2019 23:45, 22, 0.08, 69832
Male, Blue, Mercedes-Benz, TRUE, 8/27/2020 18:05, 23, 0.44, 72685
Male, Puce, Ford, TRUE, 10/18/2022 13:25, 52, 0.18, 62060
Female, Violet, Subaru, TRUE, 4/17/2021 13:17, 62, 0.17, 31095
Male, Khaki, Dodge, TRUE, 10/6/2022 13:09, 37, 0.19, 29417
Male, Violet, Chevrolet, TRUE, 6/17/2021 06:19, 59, 0.26, 74381
Male, Green, Audi, FALSE, 5/17/2022 21:24, 56, 0.25, 42414
Female, Crimson, GMC, FALSE, 12/7/2018 07:55, 25, 0.45, 69463
Female, Fuscia, Dodge, TRUE, 2/12/2020 20:27, 25, 0.4, 43763
Male, Indigo, Dodge, TRUE, 9/2/2021 16:04, 58, 0.47, 72389
Male, Orange, Mercedes-Benz, FALSE, 1/17/2022 17:18, 32, 0.38, 30000
Bigender, Fuscia, Mercedes-Benz, TRUE, 9/11/2019 17:29, 33, 0.04, 29088
Male, Khaki, Ford, TRUE, 7/11/2018 07:44, 51, 0.07, 67259
Male, Fuscia, Jaguar, FALSE, 1/3/2022 04:17, 20, 0.01, 15906
Female, Khaki, Volkswagen, TRUE, 3/25/2020 04:22, 47, 0.46, 32707
Female, Maroon, Chevrolet, FALSE, 2/8/2020 02:53, 26, 0.39, 11940
Male, Puce, Toyota, FALSE, 7/21/2019 09:12, 65, 0.22, 57477
Female, Violet, Ford, FALSE, 8/8/2019 00:32, 33, 0.32, 51731
Genderfluid, Yellow, Acura, TRUE, 12/17/2022 05:42, 61, 0.26, 50982
Female, Orange, Hyundai, TRUE, 6/16/2018 22:38, 46, 0.2, 27773
Female, Red, Volkswagen, TRUE, 11/30/2022 10:47, 44, 0.38, 61414
Female, Aquamarine, Lincoln, TRUE, 4/3/2022 06:10, 34, 0.21, 12108
Male, Maroon, Mazda, FALSE, 2/7/2021 16:43, 28, 0.17, 39283
Female, Khaki, Eagle, TRUE, 7/27/2022 10:31, 60, 0.13, 25856
Male, Purple, Mitsubishi, TRUE, 2/5/2021 00:26, 28, 0.17, 74060
Female, Blue, Cadillac, FALSE, 11/18/2018 04:28, 39, 0.38, 33070
Male, Mauv, Lexus, FALSE, 9/14/2018 13:54, 22, 0.5, 14996
Female, Yellow, Cadillac, TRUE, 7/30/2018 22:05, 53, 0.16, 36573
Male, Green, Acura, TRUE, 8/30/2022 14:45, , 0.45, 37659
Genderqueer, Turquoise, Mitsubishi, TRUE, 6/18/2019 09:56, 51, 0.47, 18712
Female, Violet, Chevrolet, TRUE, 5/28/2020 13:39, 26, 0.24, 66233
Female, Puce, Honda, FALSE, 10/28/2021 18:28, 35, 0.09, 17149
Male, Violet, Lexus, FALSE, 3/11/2021 21:15, 61, 0.07, 63457
Female, Yellow, Ford, TRUE, 4/9/2020 04:13, 39, 0.32, 27946
Male, Blue, GMC, TRUE, 8/9/2020 08:46, 46, 0.05, 24616
Female, Mauv, Dodge, TRUE, 10/6/2022 08:14, 21, 0.08, 23956
Male, Red, Isuzu, TRUE, 4/10/2018 00:57, 65, , 52656
Female, Goldenrod, Lincoln, TRUE, 10/27/2020 01:00, 22, 0.47, 49031
Bigender, Blue, Chevrolet, FALSE, 11/25/2018 03:14, 42, 0.02, 27133
Female, Green, Tesla, TRUE, 10/12/2018 16:17, 38, 0.26, 71562
Male, Pink, BMW, FALSE, 6/14/2020 19:40, 50, 0.44, 32733
Polygender, Khaki, Chevrolet, FALSE, 10/14/2022 22:28, 27, 0.4, 16778
Female, Pink, BMW, TRUE, 3/30/2019 20:25, 55, 0.28, 37975
Male, Goldenrod, Chevrolet, TRUE, 3/10/2021 16:54, 56, 0.03, 14038
Female, Crimson, Mitsubishi, FALSE, 4/10/2021 18:27, 31, 0.13, 15277
Male, Blue, Volkswagen, TRUE, 4/15/2022 04:29, 29, 0.06, 15816
Female, Goldenrod, Chevrolet, TRUE, 4/10/2021 11:06, 48, 0, 22415
Female, Turquoise, Lamborghini, FALSE, 3/29/2021 09:51, 30, 0.47, 31295
Female, Yellow, Aston Martin, FALSE, 4/17/2020 07:59, 26, 0.18, 46721
Male, Mauv, Pontiac, FALSE, 11/3/2020 14:19, 24, 0.09, 42903
Female, Indigo, Honda, TRUE, 6/12/2018 00:04, 46, 0.32, 37963
Male, Fuscia, Toyota, FALSE, 4/15/2020 13:19, 52, 0.2, 48347
Male, Goldenrod, Lexus, TRUE, 5/29/2022 19:18, 61, 0.39, 10553
Male, Turquoise, Cadillac, TRUE, 7/25/2019 02:56, 41, 0.3, 27503
Male, Pink, Mercury, FALSE, 9/1/2018 05:18, 40, 0.39, 34987
Male, Indigo, Mercedes-Benz, TRUE, 1/3/2021 19:06, 31, 0.35, 51593
Female, Indigo, Lexus, FALSE, 1/20/2020 09:35, 34, 0.19, 11038
Male, Blue, Honda, TRUE, 1/30/2022 19:50, 39, 0.14, 30024
Male, Goldenrod, Ford, TRUE, 10/23/2018 20:17, 55, 0.11, 20651
Polygender, Blue, Ford, TRUE, 8/27/2019 16:38, 40, 0.1, 31305
Female, Teal, Mercury, TRUE, 9/16/2019 10:37, 46, 0.43, 12158
Male, , Porsche, TRUE, 9/6/2018 22:06, 50, 0.48, 70313
Male, Fuscia, Chevrolet, FALSE, 2/7/2018 05:58, 59, 0.37, 14355
Male, Indigo, Mitsubishi, TRUE, 1/24/2022 10:37, 36, 0.04, 60017
Male, Indigo, Chevrolet, FALSE, 2/4/2021 05:06, 24, 0.44, 27063
Male, Maroon, Dodge, FALSE, 1/15/2018 03:10, 42, 0.04, 16502
Male, Orange, Chevrolet, TRUE, 4/11/2018 02:53, 51, 0.01, 65465
Genderqueer, Goldenrod, Hyundai, TRUE, 7/4/2022 21:26, 60, 0.4, 13817
Male, Crimson, GMC, TRUE, 3/30/2022 01:36, 28, 0.16, 43476
Male, Khaki, Honda, FALSE, 5/13/2019 19:29, 32, 0.22, 18193
Male, Red, Nissan, TRUE, 12/26/2020 01:27, 34, 0.15, 54084
Female, Maroon, Dodge, FALSE, 1/4/2021 18:57, 32, 0.36, 20008
Non-binary, Purple, Pontiac, FALSE, 5/20/2018 03:59, 63, 0.21, 48726
Male, Violet, Mazda, FALSE, 11/22/2022 17:33, 60, 0.01, 67108
Female, Purple, Dodge, FALSE, 9/22/2018 18:35, 28, 0.31, 53412
Male, Mauv, Toyota, FALSE, 9/8/2020 08:10, 51, 0.12,
Female, Crimson, Lincoln, FALSE, 2/22/2022 13:22, 53, 0.39,
Female, Aquamarine, Toyota, TRUE, 8/29/2021 03:23, 55, 0.2, 60828
Female, Violet, Nissan, FALSE, 3/22/2020 11:59, 49, 0.41, 41574
Genderqueer, Maroon, Mercedes-Benz, FALSE, 10/9/2022 15:53, 31, 0.22, 10958
Female, Goldenrod, Mercury, TRUE, 8/21/2020 07:25, , 0.28, 12741
Male, Khaki, Pontiac, TRUE, 3/15/2020 06:41, 45, 0.39, 17932
Female, Yellow, Audi, TRUE, 7/27/2022 11:26, 64, 0.05, 34588
Female, Green, Chevrolet, TRUE, 5/23/2022 06:19, 47, 0.35, 73680
Male, Turquoise, Audi, FALSE, 3/16/2018 19:01, 40, 0.29, 16814
Female, Goldenrod, Geo, TRUE, 6/11/2021 15:01, 36, 0.2, 69927
Male, Mauv, GMC, FALSE, 4/3/2020 12:58, 51, 0.47, 59063
Female, Puce, Lotus, TRUE, 11/22/2018 13:04, 28, , 33516
Male, Red, BMW, FALSE, 7/5/2022 07:59, 25, 0.36, 40990
Female, Indigo, Mazda, FALSE, 3/2/2021 23:43, 39, 0.48, 60364
Female, Crimson, GMC, FALSE, 3/5/2018 15:24, 37, 0.21, 33442
Female, Blue, Ford, TRUE, 11/8/2021 00:32, 37, 0.2, 58097
Male, Yellow, Nissan, FALSE, 10/14/2020 19:48, 34, 0.01, 71617
Male, Blue, Mercedes-Benz, FALSE, 8/22/2018 21:59, 32, 0.08, 72203
Female, Turquoise, Pontiac, FALSE, 11/24/2022 05:41, 64, 0.4, 74224
Male, Blue, Audi, FALSE, 6/21/2018 14:56, 35, 0.23, 28422
Female, Fuscia, Chevrolet, TRUE, 10/22/2018 04:12, 53, 0.2, 55601
Female, Aquamarine, Cadillac, FALSE, 7/6/2020 14:00, 23, 0.18, 49321
Male, Puce, Audi, FALSE, 12/3/2021 18:00, 34, 0.15, 60668
Female, Khaki, Nissan, FALSE, 2/19/2019 17:06, 51, , 58243
Male, Khaki, Ford, TRUE, 3/1/2019 13:08, 51, 0.24, 45572
Female, Yellow, Chevrolet, FALSE, 10/7/2020 11:15, 63, 0.14, 30940
Female, Purple, Cadillac, TRUE, 12/3/2022 03:29, 50, 0.47, 27268
Male, Red, Kia, FALSE, 10/31/2019 18:00, 53, 0.4, 46524
Female, Yellow, Chevrolet, TRUE, 10/22/2020 09:10, 57, 0.1, 47749
Female, Green, Volkswagen, TRUE, 3/10/2020 04:09, 41, 0.15, 32865
Male, Khaki, Chevrolet, TRUE, 8/3/2018 16:52, , 0.5, 40508
Female, Green, GMC, TRUE, 12/17/2019 13:19, 31, 0.49, 56161
Male, Puce, Chevrolet, TRUE, 5/22/2020 07:20, 24, 0.38, 27302
Female, Yellow, Honda, TRUE, 6/6/2021 10:16, 31, 0.37, 65094
Male, Crimson, Ford, TRUE, 6/27/2019 01:52, 37, 0.31, 30420
Male, Mauv, , TRUE, 2/27/2018 16:51, 38, 0.36, 31450
Male, Fuscia, Mitsubishi, FALSE, 12/28/2022 12:55, 63, 0.21, 23150
Male, Red, Kia, TRUE, 9/11/2021 23:24, 34, 0.3, 37176
Female, Orange, Kia, FALSE, 12/17/2018 10:32, 55, 0.27, 69578
Male, Fuscia, Mitsubishi, FALSE, 5/26/2018 02:38, 37, 0.3, 30482
Male, Crimson, Buick, FALSE, 5/3/2019 18:50, 24, 0.28, 34010
Female, Pink, Toyota, FALSE, 4/7/2022 11:39, 35, 0.31, 40801
Male, Mauv, Toyota, TRUE, 7/27/2021 03:31, 33, 0.36, 71224
Female, Fuscia, Acura, FALSE, 6/12/2020 11:29, 49, 0.24, 31637
Male, Turquoise, Isuzu, TRUE, 11/30/2018 21:54, 46, 0.05, 21662
Female, Teal, Toyota, FALSE, 3/25/2022 07:16, 24, 0.34, 17069
Female, Goldenrod, Ford, TRUE, 10/26/2020 09:03, 40, 0.08, 28327
Female, Puce, Mercedes-Benz, TRUE, 8/13/2021 15:55, 62, 0.32, 11838
Female, Yellow, Audi, FALSE, 11/16/2020 05:42, 63, 0.47, 20320
Female, Puce, , FALSE, 4/11/2022 23:02, 54, 0.43, 12684
Polygender, Orange, GMC, FALSE, 2/2/2018 19:06, 26, 0.31, 71199
Female, Green, GMC, FALSE, 4/15/2018 21:09, 53, 0.4, 56942
Male, Mauv, Infiniti, FALSE, 1/21/2018 15:31, 43, 0.48, 49811
Male, Crimson, Cadillac, TRUE, 10/7/2020 13:31, 20, 0.48, 21454
Male, Blue, Ford, FALSE, 5/31/2022 15:50, 62, 0.15, 32398
Female, Green, Porsche, FALSE, 3/29/2020 11:52, 53, 0.44, 67190
Female, Yellow, Volkswagen, TRUE, 3/3/2020 15:20, 28, 0.42, 35769
Male, Green, Mazda, FALSE, 2/28/2019 17:39, 33, 0.22, 57481
Male, Indigo, Porsche, TRUE, 4/7/2021 15:06, 61, 0.03, 42720
Male, , Toyota, FALSE, 10/20/2021 18:46, 49, 0.17, 39762
Male, Khaki, Mitsubishi, , 6/10/2019 16:54, 33, 0.22, 61992
Male, Teal, Acura, FALSE, 10/27/2022 22:50, 25, 0.2, 62754
Male, Khaki, Lamborghini, TRUE, 9/30/2019 11:51, 31, 0.09, 57438
Female, Maroon, Lincoln, FALSE, 5/21/2019 21:51, 33, 0.24, 57555
Male, Purple, Scion, FALSE, 11/2/2019 19:45, 52, 0.28, 26473
Female, Pink, Volvo, TRUE, 7/9/2020 12:57, 47, 0.32, 70107
Male, Green, Suzuki, FALSE, 10/21/2018 12:42, 34, 0.33, 65477
Male, Puce, Subaru, TRUE, 6/20/2020 03:32, 24, 0.34, 51263
Female, , Lamborghini, FALSE, 2/2/2022 13:28, , 0.05, 69540
Female, Aquamarine, Kia, TRUE, 6/17/2022 15:57, 60, 0.47, 55077
Male, Blue, Kia, TRUE, 10/3/2021 16:01, 20, 0.33, 16738
Male, Mauv, Chrysler, TRUE, 7/2/2020 19:11, 49, 0.26, 55819
Female, Khaki, Chevrolet, FALSE, 2/10/2018 21:44, 26, 0.31, 31875
Non-binary, Khaki, Chevrolet, FALSE, 8/30/2020 17:46, 51, 0.27, 20251
Female, Puce, Pontiac, FALSE, 10/12/2019 17:07, 48, 0.27, 24417
Female, Goldenrod, GMC, TRUE, 4/21/2020 00:27, 32, 0.33, 59735
Female, Mauv, Ford, TRUE, 5/20/2022 21:59, 27, 0.14, 24514
Male, Orange, Infiniti, TRUE, 12/28/2022 13:20, 48, 0.03, 44804
Female, Aquamarine, Lexus, TRUE, 3/8/2022 17:25, 56, 0.47, 59964
Female, Mauv, Acura, TRUE, 10/20/2020 20:20, 46, 0.32, 27015
Female, Maroon, Dodge, FALSE, 12/14/2019 19:11, 31, 0.23, 47419
Male, Maroon, Dodge, FALSE, 10/28/2021 04:17, 56, 0.46, 33712
Female, Aquamarine, Chrysler, TRUE, 5/29/2022 16:54, 28, 0.28, 23966
Male, Red, Toyota, TRUE, 2/12/2021 00:36, 34, 0.11, 67972
Male, Mauv, Audi, TRUE, 1/1/2018 21:01, 57, 0.3, 74112
Male, Violet, Honda, FALSE, 2/14/2020 11:01, 63, 0.34, 67506
Female, Orange, Dodge, FALSE, 9/17/2018 00:02, 22, 0.38, 47283
Female, Yellow, Hummer, FALSE, 1/13/2020 13:39, , 0.17, 23826
Female, Indigo, Volkswagen, TRUE, 2/8/2019 23:22, 59, 0.12, 61373
Female, Maroon, Mercury, TRUE, 5/2/2021 18:34, 65, 0.25, 37346
Male, Puce, Cadillac, TRUE, 12/10/2019 18:58, 32, 0.41, 55126
Male, Violet, Toyota, TRUE, 5/12/2019 17:13, 30, 0.42, 18029
Female, Indigo, Toyota, TRUE, 1/22/2019 05:42, 45, 0.36, 33192
Male, Puce, Daewoo, TRUE, 12/13/2019 08:22, 41, 0.09, 34908
Male, Red, Hyundai, , 2/27/2018 13:46, 41, 0.32, 64273
Female, Teal, Volvo, FALSE, 8/17/2022 01:22, 55, 0.03, 73122
Male, Puce, Ford, FALSE, 3/14/2021 08:08, 28, 0.42, 62042
Male, Teal, Chevrolet, FALSE, 8/31/2019 05:45, 58, 0.43, 26659
Male, Yellow, BMW, FALSE, 7/25/2021 00:46, 39, 0.02, 17269
Male, Aquamarine, Dodge, TRUE, 2/17/2021 20:43, 28, 0.26, 59342
Male, Blue, Nissan, TRUE, 3/30/2019 22:00, 60, 0.34, 65747
Female, Crimson, Bentley, TRUE, 2/6/2021 07:38, 53, 0.31, 41060
Agender, Purple, Volkswagen, TRUE, 10/4/2021 00:37, 60, 0.32, 69006
Female, Aquamarine, Mercury, FALSE, 12/18/2022 19:56, 24, 0.36, 70507
Male, Puce, Suzuki, TRUE, 9/10/2018 04:46, 48, 0.22, 68001
Female, Turquoise, Mercury, TRUE, 4/30/2020 13:09, 37, 0.09, 18989
Female, Green, Cadillac, FALSE, 3/19/2021 06:56, 48, 0.07, 13822
