Bigender, Red, Mercury, FALSE, 8/18/2022 08:50, 47, 0.07, 45355
Agender, Blue, Chevrolet, FALSE, 8/17/2020 10:49, 45, 0.11, 66498
Female, Mauv, Maserati, FALSE, 6/23/2019 20:32, 64, 0.33, 37982
Female, Yellow, Mazda, TRUE, 1/24/2019 04:22, 54, 0.15, 58787
Male, Orange, Subaru, FALSE, 8/6/2019 21:41, 64, 0.01, 27047
Female, Turquoise, Chevrolet, FALSE, 9/1/2020 03:35, 52, 0.25, 45074
Male, Red, Ford, TRUE, 11/3/2020 17:46, 28, 0.17, 16224
Female, Indigo, Mitsubishi, TRUE, 8/27/2020 17:40, 33, 0.21, 51521
Female, Orange, Saab, FALSE, 6/13/2021 13:20, 24, 0.44, 45946
Female, Purple, Pontiac, TRUE, 7/5/2020 13:09, 42, 0.3, 28268
Polygender, Red, Dodge, TRUE, 7/24/2019 17:55, 58, 0.32, 74196
Male, Purple, Toyota, TRUE, 7/31/2021 03:33, 33, 0.39, 10948
Female, Green, Lotus, TRUE, 10/6/2018 16:03, 64, 0.44, 27104
Male, Crimson, Aston Martin, TRUE, 8/10/2018 21:32, 29, 0.11, 34235
Female, Pink, Saturn, TRUE, 9/18/2021 12:06, 26, 0.19, 36156
Female, Turquoise, Nissan, TRUE, 6/24/2021 15:45, 33, 0.27, 40378
Male, Yellow, Dodge, FALSE, 2/14/2018 08:33, 54, 0.39, 64165
Male, Maroon, Buick, FALSE, 11/1/2019 05:03, 65, 0.19, 40121
Male, Aquamarine, Honda, TRUE, 12/15/2020 11:36, 53, 0.14, 29132
Non-binary, Yellow, Chevrolet, FALSE, 11/13/2022 06:23, 25, 0.46, 50109
Female, Orange, GMC, TRUE, 6/9/2022 03:49, 34, 0.12, 17204
Female, Green, Acura, FALSE, 7/5/2021 11:47, 64, 0.27, 25703
Female, Yellow, Ford, FALSE, 3/21/2020 05:42, 36, 0.4, 26351
Female, Violet, Toyota, FALSE, 3/3/2021 16:33, 33, 0.22, 70931
Female, Aquamarine, Mazda, FALSE, 10/20/2022 12:54, 49, 0.26, 48112
Female, Mauv, , TRUE, 11/25/2018 16:49, 21, 0.47, 70714
Female, Indigo, Studebaker, FALSE, 7/14/2019 07:33, 47, 0.31, 48844
Female, Teal, Ford, TRUE, 12/19/2018 09:55, 46, 0.44, 44278
Female, Goldenrod, GMC, FALSE, 5/13/2019 00:12, 29, 0.33, 67938
, Mauv, Lexus, FALSE, 12/31/2019 02:39, 37, 0.37, 28689
Male, Aquamarine, Jeep, TRUE, 3/13/2022 22:23, 38, 0.32, 66720
Male, Red, Acura, FALSE, 11/28/2019 17:55, , 0.45, 47884
Male, Green, Saturn, TRUE, 2/4/2020 05:26, 59, 0.26, 49432
Female, Maroon, Panoz, TRUE, 10/19/2021 13:39, 27, 0.23, 28042
Male, Orange, Aston Martin, TRUE, 7/23/2019 11:32, 55, 0.39, 59219
Female, Violet, Mercury, FALSE, 5/1/2021 01:34, 49, 0, 54228
Female, Purple, Lexus, TRUE, 10/29/2020 13:12, 64, 0.36, 15722
Male, Crimson, Nissan, FALSE, 12/10/2018 04:34, 30, 0.16, 34654
Male, Mauv, Chevrolet, FALSE, 10/21/2018 16:48, 23, 0.46, 46551
Female, Violet, Mitsubishi, TRUE, 10/1/2021 15:51, 61, 0.2, 27458
Male, Yellow, Pontiac, TRUE, 1/22/2021 14:32, 29, 0.05, 58719
Female, Turquoise, Audi, FALSE, 1/3/2022 15:13, 50, 0.09, 20761
Male, Mauv, Pontiac, TRUE, , 51, 0.04, 52544
Male, Teal, Dodge, FALSE, 12/11/2020 02:52, 65, 0.46, 16852
Male, Khaki, Volkswagen, TRUE, 4/17/2018 06:53, 20, 0.08, 13775
Genderfluid, Pink, BMW, TRUE, 4/1/2022 02:47, 61, 0.09, 48927
Male, Goldenrod, Oldsmobile, FALSE, 7/13/2019 14:39, 26, 0.35, 23612
Female, Red, Dodge, TRUE, 8/10/2021 17:10, 26, 0.01, 29405
Female, Pink, Toyota, TRUE, 3/27/2021 23:09, 47, 0.43, 22834
Male, Mauv, Volkswagen, FALSE, 8/31/2019 04:39, 40, 0.01, 31875
Female, Khaki, Audi, FALSE, 4/30/2019 04:27, 37, 0.19, 25629
Bigender, Khaki, Isuzu, FALSE, 3/31/2019 00:32, 38, 0.17, 58507
Male, Purple, GMC, TRUE, 9/26/2019 00:26, 45, 0.28, 65833
Female, Maroon, Volvo, TRUE, 3/1/2020 00:24, 53, 0.33, 37742
Male, Puce, Ford, TRUE, 1/22/2021 17:06, 63, 0.08, 11900
Female, Mauv, Porsche, TRUE, 1/20/2020 00:31, 47, 0.23, 62228
Male, Khaki, Nissan, FALSE, 3/4/2022 04:41, 43, 0.12, 71046
Male, Orange, Chevrolet, TRUE, 12/14/2021 07:58, 54, 0.32, 17865
Female, Indigo, Maserati, TRUE, 2/8/2020 22:53, 40, 0.08, 43506
Male, Yellow, Subaru, TRUE, 6/7/2021 03:41, 55, 0.15, 42365
Genderfluid, Maroon, Ford, FALSE, 9/16/2019 07:10, 56, 0.33, 30952
Male, Yellow, Mitsubishi, FALSE, 1/30/2020 08:06, 39, 0.03, 60533
Male, Indigo, Isuzu, TRUE, 4/2/2020 05:37, 48, 0.47, 63391
Female, Green, Toyota, TRUE, 6/2/2020 14:11, 30, 0.45, 53856
Male, Crimson, Buick, FALSE, 3/4/2020 01:11, 33, 0.08, 32329
Male, Goldenrod, Mercury, TRUE, 12/30/2018 20:43, 21, 0.36, 40249
Male, Violet, GMC, TRUE, 4/28/2021 08:35, 20, 0.1, 46271
Male, Teal, Mazda, FALSE, 11/14/2019 15:21, 37, 0.16, 40561
Male, Teal, Land Rover, TRUE, 5/10/2022 09:29, 46, 0.47, 41297
Genderfluid, Violet, Mitsubishi, TRUE, 3/29/2022 14:06, 31, 0.39, 49079
Female, Teal, Saturn, FALSE, 11/27/2021 14:01, 26, 0.3, 69644
Female, Violet, Lexus, TRUE, 5/1/2020 18:41, 28, 0.4, 12343
Female, Red, Acura, TRUE, 7/25/2021 12:11, 31, 0.05, 17262
Female, Puce, Jaguar, FALSE, 6/8/2019 06:18, , 0.11, 70035
Female, Mauv, Dodge, FALSE, 7/16/2019 19:01, 21, 0.09, 23659
Male, Mauv, Toyota, FALSE, 12/10/2020 13:20, 49, 0.11, 47867
Female, Turquoise, BMW, TRUE, 11/2/2021 21:00, 62, 0.05, 30995
Male, Teal, Audi, TRUE, 7/2/2019 23:06, 23, 0.29, 52243
Female, Yellow, Infiniti, FALSE, 8/26/2021 02:53, 24, 0.28, 44072
Male, Puce, Lamborghini, TRUE, 5/29/2019 14:08, 65, 0.5, 59760
Female, Mauv, Maserati, TRUE, 12/11/2018 23:33, 22, 0.47, 50479
Female, Purple, Hyundai, FALSE, 10/15/2019 20:07, 35, 0.49, 50762
Female, Puce, Mercury, FALSE, 11/11/2021 19:36, 57, 0.05, 38201
Male, Fuscia, Ford, FALSE, 2/26/2021 03:20, 60, 0.31, 73371
Female, Green, Mitsubishi, FALSE, 11/14/2022 04:45, 35, 0.16, 65861
Female, Maroon, BMW, TRUE, 11/25/2021 10:19, 29, 0.42, 21048
Female, Indigo, Mercury, FALSE, 10/13/2020 06:07, 25, 0.11, 33128
Genderqueer, Blue, Suzuki, TRUE, 6/13/2020 04:23, 47, 0.25, 50097
Female, Maroon, Toyota, FALSE, 12/18/2021 14:48, 59, 0.39, 69115
Male, Orange, BMW, TRUE, 7/17/2022 22:22, 35, 0.23, 67567
Male, Green, Nissan, TRUE, 7/31/2020 00:52, 39, 0.4, 61234
Male, Turquoise, Acura, , 3/7/2019 18:38, 45, 0.19, 62511
Male, Green, BMW, TRUE, 6/8/2019 04:17, 36, 0.28, 38688
Female, Indigo, Maserati, TRUE, 12/20/2018 08:08, 44, 0.49, 68448
Male, Orange, Maybach, TRUE, 3/18/2022 01:08, 25, 0.1, 19437
Female, Puce, Nissan, TRUE, 8/16/2020 07:36, 20, 0.37, 12772
Agender, Green, Mercury, TRUE, 5/5/2021 00:32, 39, 0.44, 15339
Male, Crimson, Dodge, TRUE, 1/17/2021 19:12, 57, 0.41, 26672
Female, Aquamarine, Rolls-Royce, FALSE, 1/4/2021 22:27, 40, 0.26, 13087
Female, Fuscia, Jeep, FALSE, 3/24/2019 14:02, 63, 0.28, 62784
Male, Khaki, Dodge, TRUE, 4/26/2019 08:45, 57, 0.22, 33328
, Teal, Mercedes-Benz, FALSE, 12/18/2018 05:05, 30, 0.45, 35685
Male, Maroon, Nissan, TRUE, 3/1/2020 19:57, 29, 0.17, 24884
Male, Yellow, Pontiac, TRUE, 6/21/2018 17:15, 61, 0.25, 34423
Female, Blue, Volkswagen, FALSE, 2/5/2022 22:19, 62, 0.1, 73622
Female, Blue, Bugatti, FALSE, 4/30/2021 14:36, 47, 0.1, 18540
Female, Khaki, Volkswagen, FALSE, 1/16/2018 03:14, , 0.34, 13790
Bigender, Indigo, Mercury, TRUE, 4/13/2020 10:01, 48, 0.11, 15189
Male, Yellow, Audi, TRUE, 5/15/2022 06:27, 58, 0.23, 56683
Male, Green, Infiniti, TRUE, 6/26/2018 01:53, 20, 0.39, 20913
Male, Teal, , TRUE, 10/9/2019 13:44, 21, 0.09, 47289
Female, Indigo, Ford, TRUE, 11/28/2021 03:52, 54, 0.09, 28932
Male, Purple, Nissan, FALSE, 3/9/2022 22:57, 57, 0.24, 34873
Bigender, Aquamarine, Mercedes-Benz, TRUE, 10/29/2018 17:02, 44, 0.45, 69173
Female, Fuscia, Mazda, TRUE, 7/27/2021 17:42, 42, 0.4, 10465
Male, Mauv, Mazda, FALSE, 5/14/2020 06:44, 42, 0.13, 49361
Male, Orange, Kia, TRUE, 2/8/2022 19:23, 48, 0.46, 67558
Female, Orange, Lincoln, TRUE, 4/17/2019 06:13, 65, 0.05, 32405
Female, Aquamarine, Mercedes-Benz, TRUE, 10/6/2019 23:14, 34, 0.37, 21431
Female, Maroon, Aston Martin, FALSE, 4/29/2018 19:48, 54, 0.14, 48682
Female, Orange, Chevrolet, TRUE, 4/27/2019 02:50, 41, 0.34, 13722
Polygender, Puce, Audi, TRUE, 5/20/2022 02:11, 52, 0.36, 54895
Female, Maroon, Hyundai, TRUE, 8/14/2022 00:21, 29, 0.28, 29996
Male, Maroon, GMC, TRUE, 6/9/2020 05:32, 47, 0.49, 29515
Female, Orange, Suzuki, TRUE, 12/8/2022 03:17, 38, 0.07, 63161
Male, Violet, Saturn, TRUE, 11/12/2020 04:45, 32, 0.32, 74736
Female, Indigo, GMC, FALSE, 11/15/2021 09:33, 45, 0.03, 50785
Polygender, Teal, Volvo, TRUE, 1/31/2018 22:38, 27, 0.04, 58714
Male, Violet, BMW, FALSE, 10/13/2021 01:45, 47, 0.3, 32147
Bigender, Crimson, Mazda, TRUE, 11/16/2021 12:05, 26, 0.27, 38794
Male, Indigo, Lexus, FALSE, 12/18/2022 00:28, 50, 0.12, 74186
Female, Maroon, Ford, FALSE, 1/9/2019 03:52, 24, 0.47, 51204
Male, Violet, Hyundai, TRUE, 11/14/2019 05:49, 37, 0.49, 41633
Male, Turquoise, Alfa Romeo, TRUE, 7/7/2021 05:55, 40, 0.2, 67395
Female, Pink, Toyota, FALSE, 9/26/2019 21:09, 27, 0.45, 14320
Female, Goldenrod, Mazda, TRUE, 12/4/2019 09:37, 37, 0.37, 12056
Female, Red, Volkswagen, TRUE, 11/21/2019 22:39, 33, 0.43, 15151
Female, Pink, Nissan, TRUE, 4/10/2018 09:16, 33, 0.36, 44128
Female, Aquamarine, Mitsubishi, TRUE, 2/17/2022 09:49, 46, 0.25, 62063
Male, Purple, Chevrolet, TRUE, 6/6/2018 17:41, 53, 0.06, 72698
Female, Indigo, GMC, TRUE, 2/1/2019 18:31, 54, 0.37, 46761
Male, Yellow, Infiniti, FALSE, 8/13/2022 21:22, 61, 0.37, 15541
Male, Aquamarine, GMC, TRUE, 8/31/2018 10:18, 41, 0.28, 58046
Male, Mauv, Chevrolet, TRUE, 5/22/2020 07:47, 44, 0.38, 38470
Male, Turquoise, Lexus, TRUE, 4/3/2021 18:02, 22, 0.21, 12031
Male, Goldenrod, Cadillac, TRUE, 10/16/2020 15:05, 62, 0.12, 54007
Female, Aquamarine, Honda, FALSE, 10/13/2021 01:56, 50, 0.16, 55609
Female, Pink, Lexus, TRUE, 1/14/2022 00:56, 53, 0.32, 33757
Male, Indigo, Nissan, FALSE, 9/9/2022 09:35, 24, 0.39, 30525
Bigender, Blue, Mitsubishi, TRUE, 11/22/2021 23:04, 62, 0.37, 57542
Female, Teal, Mercedes-Benz, TRUE, 4/26/2022 02:57, 62, 0.32, 22880
Male, Purple, Chevrolet, FALSE, 10/23/2020 22:16, 33, 0.03, 72933
Female, Turquoise, Suzuki, FALSE, 3/8/2022 11:12, 53, 0.38, 35670
Female, Blue, Dodge, FALSE, 11/8/2018 00:15, 33, 0.16, 43973
Male, Aquamarine, Buick, FALSE, , 31, 0.39, 40473
Male, Mauv, Jeep, TRUE, 4/3/2019 16:08, 21, 0.46, 46952
Genderqueer, Maroon, Mazda, , 8/12/2022 18:56, 22, 0.09, 59370
Male, Khaki, Toyota, TRUE, 6/15/2018 23:06, 62, 0.44, 27465
Female, Khaki, Chevrolet, FALSE, 5/25/2022 17:38, 48, 0.27, 53241
Male, Khaki, Toyota, FALSE, 2/13/2019 17:05, 22, 0.03, 34078
Bigender, Puce, Dodge, FALSE, 10/5/2018 10:42, 56, 0.06, 27206
Male, Violet, Isuzu, TRUE, 2/13/2021 02:26, 20, 0.16, 13885
Male, Turquoise, Jaguar, FALSE, 6/17/2019 06:16, 41, 0.39, 27123
Male, Violet, Mitsubishi, TRUE, 12/29/2020 08:46, 26, 0.16, 43229
Bigender, Aquamarine, Mitsubishi, TRUE, 2/26/2019 23:42, 44, 0.18, 71771
Male, Teal, Hummer, TRUE, 7/7/2020 15:53, 46, 0.06, 43293
Male, Puce, Dodge, TRUE, 4/11/2020 23:15, 64, 0.11, 45429
Female, Blue, Lotus, TRUE, 12/4/2018 18:35, 33, 0.03, 54547
Non-binary, Violet, Saturn, FALSE, 5/10/2018 08:24, 40, 0.22, 65450
Male, Khaki, Pontiac, TRUE, 9/5/2019 15:43, 28, 0.07, 41513
Female, Yellow, Toyota, TRUE, 6/7/2018 11:26, 33, 0.42, 69693
Female, Mauv, Dodge, TRUE, 9/10/2022 12:24, 51, 0.01, 40042
Female, Orange, Porsche, FALSE, 11/20/2020 11:56, 45, 0.24, 69914
Genderfluid, Khaki, Chevrolet, FALSE, 6/29/2020 02:40, 46, 0.4, 56479
Female, Fuscia, , TRUE, 2/3/2019 00:25, 56, 0.08, 62427
Female, Fuscia, Ford, FALSE, 9/3/2022 02:29, 58, 0.49, 39495
Female, Green, GMC, TRUE, 8/25/2021 23:02, 49, 0.01, 60922
Male, Fuscia, Dodge, FALSE, 1/11/2020 16:00, 60, 0.32, 25048
Female, Orange, Acura, TRUE, 10/19/2020 16:39, 31, 0.19, 15433
Male, Goldenrod, Chevrolet, TRUE, 6/2/2020 21:32, 26, 0, 25634
Female, Indigo, Dodge, FALSE, 5/16/2019 18:42, 36, 0.23, 63644
Male, Puce, Ford, TRUE, 3/29/2020 09:27, , 0.09, 65418
Female, Maroon, Ford, TRUE, 2/16/2018 05:13, 59, 0.11, 44119
Polygender, Teal, Chrysler, TRUE, 12/2/2022 05:59, 50, 0.12, 68340
Male, Red, Audi, FALSE, 11/19/2020 12:53, 34, 0.44, 50033
Male, Green, Ford, FALSE, 9/24/2020 09:05, 26, 0.28, 54535
Female, Violet, GMC, FALSE, 12/17/2021 23:20, 59, 0.36, 68204
Female, Turquoise, Buick, TRUE, 6/13/2020 23:51, 31, 0.3, 55691
Male, Red, Chevrolet, FALSE, 3/16/2022 09:12, 34, 0.15, 34581
Male, Goldenrod, Ford, FALSE, 4/13/2020 07:46, 49, 0.08, 32777
Female, Aquamarine, Volvo, FALSE, 3/19/2018 13:39, 53, 0.08, 19003
Female, Purple, Oldsmobile, FALSE, 8/24/2019 21:42, 62, 0.18, 26548
Female, Indigo, BMW, FALSE, 2/7/2022 08:00, 41, 0.07, 65712
Female, Crimson, Isuzu, FALSE, 6/19/2019 16:34, 58, 0.06, 42459
Male, Maroon, Ford, FALSE, 10/30/2018 10:08, 34, 0.34, 21858
Female, Fuscia, BMW, FALSE, 5/25/2020 15:13, 30, 0.46, 68404
Male, Fuscia, Nissan, , 3/23/2018 19:18, 39, 0.42, 64437
Agender, Crimson, Subaru, TRUE, 1/11/2021 05:16, 62, 0.39, 56349
Female, Turquoise, Audi, TRUE, 5/18/2022 03:15, 24, 0.42, 58236
Genderfluid, Teal, Mazda, FALSE, 8/6/2020 12:01, 22, 0.42, 18137
Male, Turquoise, Mitsubishi, FALSE, 4/27/2020 23:56, 44, 0.28, 68251
Female, Fuscia, Dodge, FALSE, 11/10/2019 01:32, 48, 0.19, 58506
Female, Fuscia, Chevrolet, FALSE, 10/7/2019 07:55, 31, 0.14, 34629
Female, Green, Honda, TRUE, 9/25/2022 00:28, 36, , 53143
Male, Goldenrod, Infiniti, FALSE, 5/23/2022 00:34, 22, 0.14, 72074
Female, Aquamarine, Mercury, FALSE, , 48, 0.13, 73109
Polygender, Teal, GMC, FALSE, 9/6/2021 03:29, 44, 0.49,
Female, Fuscia, Subaru, FALSE, 8/29/2019 22:06, 36, 0.13, 38804
Female, Red, Ford, FALSE, 9/30/2020 09:22, 21, , 48889
Male, Purple, Chevrolet, FALSE, 5/3/2018 06:38, 60, 0.03, 16484
Male, Teal, GMC, FALSE, 7/25/2018 08:54, 37, 0.2, 40530
Male, Aquamarine, Mercury, FALSE, 10/4/2021 13:20, 48, 0.19, 67320
Female, Violet, Pontiac, FALSE, 1/19/2022 21:01, 61, 0.15, 43515
Female, Mauv, Mercedes-Benz, TRUE, 10/13/2021 04:35, 23, 0.48, 46950
Male, Maroon, Mercury, TRUE, 2/27/2022 18:59, 61, 0.15, 61469
Female, Red, Porsche, FALSE, 6/15/2022 16:02, 43, 0.3, 65844
Male, Yellow, Chevrolet, TRUE, 8/6/2022 10:33, 38, 0.36, 11401
Female, Yellow, Isuzu, FALSE, 10/25/2022 04:23, , 0.43, 67755
Male, Turquoise, , FALSE, 12/13/2019 06:55, 62, 0.15, 26657
Female, Teal, Pontiac, FALSE, 4/29/2020 13:46, 44, 0.43, 46059
Female, Blue, Mitsubishi, FALSE, 10/11/2020 01:21, 35, 0.11, 44113
Female, Teal, Dodge, TRUE, 6/27/2019 10:23, 20, 0.06, 55291
Male, Turquoise, Daewoo, FALSE, 8/22/2019 20:04, 63, 0.31, 68121
Agender, Teal, Lexus, FALSE, 11/1/2022 21:14, 60, 0.49, 36723
Female, Puce, Maserati, FALSE, 9/29/2020 01:01, 35, 0.47, 39354
Male, Fuscia, Ford, TRUE, 5/14/2021 12:20, 44, 0.01, 74710
Female, Aquamarine, Subaru, TRUE, 5/2/2019 21:09, 26, 0.12, 54528
Male, Fuscia, Ford, TRUE, 1/9/2022 13:19, 39, 0.48, 65601
Female, Mauv, Mercedes-Benz, TRUE, 4/24/2018 15:33, 46, 0.38, 40966
Female, Mauv, Chrysler, TRUE, 6/14/2021 21:17, 34, 0.22, 27305
Male, Teal, Pontiac, FALSE, 2/2/2020 15:38, 60, 0.37, 66741
Male, Maroon, Honda, TRUE, 10/18/2018 15:05, 57, 0.2, 38330
Male, Puce, Subaru, TRUE, 11/16/2019 21:33, 56, 0.19, 42302
Female, Mauv, Aptera, FALSE, 11/26/2019 02:28, 43, 0.03, 52023
Genderfluid, Crimson, Chevrolet, TRUE, 11/6/2018 03:53, 35, 0.07, 43826
Female, Blue, Ford, TRUE, 12/24/2020 08:01, 54, 0.17, 64722
Male, Yellow, Toyota, FALSE, , 30, 0.29, 32070
Female, Pink, Mazda, FALSE, 10/27/2019 12:28, 28, 0.33, 13053
Male, Red, Pontiac, FALSE, 10/3/2019 12:42, 30, 0.46,
Female, Puce, Buick, FALSE, 12/28/2019 14:57, 33, 0.49, 23721
Female, Indigo, Chrysler, TRUE, 3/1/2020 07:38, 51, 0.24, 65768
Female, Green, Ford, TRUE, 3/12/2018 16:44, 43, 0.03, 51622
Male, Purple, Mazda, FALSE, 2/2/2021 01:23, 63, 0.1, 24417
Bigender, Goldenrod, Audi, FALSE, 12/24/2021 12:08, 57, 0.2, 46275
Female, Goldenrod, Dodge, FALSE, 10/21/2018 12:31, 61, 0.48, 47849
Male, Blue, GMC, FALSE, 4/30/2022 11:47, 62, 0.21, 24844
Male, Yellow, Suzuki, FALSE, 5/24/2020 17:53, 29, 0.01, 46237
Female, Turquoise, Nissan, FALSE, 3/22/2019 07:40, 32, 0.18, 39964
Non-binary, Blue, Mercedes-Benz, FALSE, 4/13/2019 00:27, 30, 0.33, 54419
Female, Aquamarine, Cadillac, TRUE, 1/21/2020 14:33, 44, 0.22, 17614
Male, Violet, Oldsmobile, FALSE, 4/23/2021 00:24, 46, 0.17, 72646
Female, Fuscia, Mitsubishi, FALSE, 5/31/2018 16:28, 45, 0.34, 46882
Agender, Green, Mercury, FALSE, 1/21/2018 13:11, 34, 0.07, 39718
Male, , Lexus, TRUE, 3/18/2020 01:32, 53, 0.32, 56428
Female, Red, Lexus, TRUE, 3/12/2019 07:17, 39, 0.35, 10105
Male, Purple, Plymouth, FALSE, 1/16/2019 20:15, 42, 0.36, 67841
Female, Teal, , FALSE, 12/24/2018 19:40, 64, 0.23, 38390
Male, Turquoise, Saab, TRUE, 11/21/2021 01:43, 55, 0.42, 20350
Male, Goldenrod, Mitsubishi, TRUE, 10/9/2021 13:36, 41, 0.23, 57487
Male, Orange, Subaru, TRUE, 4/26/2021 01:39, 34, 0.19, 34428
Male, Red, Spyker, TRUE, 8/3/2019 00:06, 43, 0.4, 50562
Female, Mauv, Chevrolet, FALSE, 12/1/2020 20:34, 44, 0.15, 20540
Female, Orange, Infiniti, TRUE, 6/23/2020 06:55, 26, 0.48, 11715
Male, Maroon, Volvo, TRUE, 2/2/2022 22:51, 32, 0.12, 54349
Male, Fuscia, Oldsmobile, TRUE, 10/17/2020 12:06, 58, 0.4, 54211
Female, Red, Saab, FALSE, 1/20/2021 06:12, 20, 0.28, 64437
Male, Green, Buick, TRUE, 3/21/2018 13:27, 30, 0.3, 60340
Female, Puce, BMW, FALSE, 10/29/2019 23:49, 22, 0.15, 12538
Male, Purple, Pontiac, TRUE, 11/14/2021 20:25, 65, 0.23, 57910
Female, Turquoise, Ford, FALSE, 12/6/2020 03:56, 35, 0.36, 35529
Female, Aquamarine, Ford, FALSE, 1/29/2019 19:10, 28, 0.07, 19410
Female, Blue, Hummer, TRUE, 3/13/2022 07:25, 21, 0.01, 59421
Female, , Volkswagen, TRUE, 5/18/2018 10:58, 30, 0.23, 71383
Male, Blue, Chevrolet, TRUE, 10/9/2018 16:33, 46, 0.36, 69255
Female, Orange, Plymouth, FALSE, 11/2/2021 03:59, 40, 0.36, 47279
Female, Orange, GMC, FALSE, 5/13/2018 09:11, 42, 0.03, 61463
Female, Purple, Mercury, TRUE, 1/24/2022 20:52, 51, 0, 56528
Male, Goldenrod, Lexus, TRUE, 6/3/2021 05:15, 35, 0.5, 37022
Male, Indigo, Toyota, TRUE, 2/9/2019 06:18, 38, 0.32, 12614
Female, Purple, BMW, TRUE, 4/7/2019 03:17, 60, 0.3, 71427
Male, Indigo, Infiniti, FALSE, 5/8/2019 10:14, 30, 0.34, 18535
Female, Blue, Subaru, FALSE, 5/3/2018 03:29, 37, 0.1, 67310
Female, Yellow, GMC, FALSE, 9/8/2021 09:23, 27, 0.22, 42289
Male, Maroon, Chrysler, FALSE, 3/29/2018 03:24, 20, 0.21, 14884
Female, Green, Pontiac, FALSE, 11/23/2022 08:46, 39, 0.02, 28140
Male, Orange, Suzuki, TRUE, 6/16/2018 04:13, 36, 0.36, 29702
Male, Orange, Volkswagen, FALSE, 9/27/2021 11:18, 44, 0.21, 33665
Female, Indigo, GMC, FALSE, 11/19/2018 19:54, 24, 0.14, 53167
Male, Goldenrod, Toyota, TRUE, 11/1/2022 15:57, 26, 0.34, 62556
Male, Khaki, GMC, TRUE, 12/31/2021 18:51, 56, 0.34, 62873
Female, Fuscia, Nissan, TRUE, 12/14/2020 01:31, 65, 0.37, 62274
Female, Khaki, Dodge, TRUE, , 59, 0.2, 54581
Female, Pink, Pontiac, TRUE, 3/11/2020 21:32, 52, 0.42, 25045
Female, Goldenrod, Mitsubishi, FALSE, 3/7/2022 15:26, 58, 0.11, 27960
Female, Mauv, Chevrolet, FALSE, 10/29/2020 12:15, 52, 0.48, 53198
Male, Blue, Ford, TRUE, 1/6/2021 19:08, 63, 0.26, 45590
Genderqueer, Indigo, Ford, TRUE, 1/8/2020 05:12, 28, 0.02, 47140
Agender, Aquamarine, Toyota, FALSE, 8/29/2022 21:39, 39, 0.31, 63191
Male, Teal, Maserati, FALSE, 1/26/2018 17:13, 39, 0.41, 45010
Male, Teal, Chevrolet, TRUE, 11/9/2021 16:15, 55, 0.35, 10990
Female, Orange, Dodge, TRUE, 7/14/2022 21:13, 45, 0.04, 67628
Male, Pink, Chevrolet, TRUE, 1/27/2020 03:28, 40, 0.19, 45355
Female, Puce, Ford, TRUE, 1/19/2019 09:44, 25, 0.09, 56829
Female, Purple, Lamborghini, FALSE, 1/22/2019 09:45, 41, 0.11, 29125
Female, Violet, Toyota, TRUE, 5/3/2022 16:28, 46, 0.12, 39404
Male, Violet, Toyota, TRUE, 8/15/2022 23:38, 36, 0.09, 65750
Female, Puce, Acura, FALSE, 2/5/2018 13:18, 47, 0.38, 33677
Female, Puce, , TRUE, 5/13/2022 16:34, 25, 0.39, 18997
Male, Fuscia, Cadillac, FALSE, 8/28/2020 11:23, 64, 0.35, 39326
Male, Violet, Chevrolet, TRUE, 12/27/2018 06:29, 32, 0.37, 44514
Female, Teal, Buick, TRUE, 10/21/2019 17:24, , 0.26, 65405
Male, Red, Pontiac, TRUE, 3/13/2019 14:00, 58, 0.06, 56092
Female, Green, Oldsmobile, FALSE, 11/13/2018 03:33, 42, 0.41, 46324
Non-binary, , Lexus, TRUE, 2/14/2019 00:45, 51, 0.44, 43402
Female, Aquamarine, Mazda, TRUE, 6/9/2018 12:59, 52, 0.14, 10672
Polygender, Turquoise, Ford, FALSE, 12/10/2020 20:21, 28, 0.39, 31893
Female, Maroon, Lamborghini, TRUE, 10/22/2018 05:49, 32, 0.23, 65559
Male, Indigo, Lincoln, TRUE, 8/31/2018 06:04, 59, 0.32, 73447
Female, Purple, Toyota, TRUE, 8/2/2021 11:45, 60, 0.49, 24247
Male, Orange, Mercedes-Benz, FALSE, 12/29/2022 03:37, 21, 0.25, 69077
Male, Purple, GMC, TRUE, 5/15/2022 17:05, 37, 0.06, 36863
Male, Blue, Chevrolet, TRUE, 7/19/2018 13:34, , 0.04, 52165
Female, Red, Oldsmobile, TRUE, 3/6/2020 09:58, 52, 0.37, 42585
Female, Green, Dodge, TRUE, 5/12/2021 10:52, 20, 0.08, 40083
Female, Maroon, Mazda, FALSE, 3/24/2020 09:10, 30, 0.06, 38642
Female, Orange, Mercury, FALSE, 6/13/2019 00:38, 29, 0.14, 39652
Female, Yellow, Chrysler, FALSE, 11/19/2021 09:48, 21, 0.13, 50731
Genderfluid, Teal, Kia, TRUE, 7/29/2018 15:47, 54, 0.4,
Male, Maroon, Nissan, TRUE, 2/4/2021 03:19, 59, 0.06, 42011
Female, Indigo, GMC, TRUE, 9/4/2019 15:21, 21, 0.26, 17176
Male, Puce, GMC, FALSE, 1/30/2019 04:01, 35, 0.05, 55618
Male, Red, Bentley, TRUE, 1/5/2021 16:31, 38, 0.24, 27034
Male, Pink, Porsche, TRUE, 3/21/2021 22:33, 24, 0.06, 69455
Female, Fuscia, Subaru, FALSE, 10/12/2019 20:26, 59, 0.38, 63118
Female, Violet, Porsche, TRUE, 8/1/2019 11:58, 34, 0.5, 26633
Female, Violet, Mitsubishi, FALSE, 2/29/2020 13:11, 33, 0.2, 38242
Male, Purple, Volvo, FALSE, 2/17/2022 23:25, 56, 0.47, 59747
Female, Indigo, Subaru, TRUE, 6/2/2021 04:57, 52, 0, 55717
Male, Blue, Plymouth, TRUE, 6/21/2020 13:38, 49, 0.45, 50796
Male, Maroon, BMW, TRUE, 2/14/2021 16:22, 37, 0.17, 17797
Polygender, Blue, Ford, TRUE, 12/10/2020 14:53, 33, 0.24, 12607
Genderqueer, Puce, Mitsubishi, TRUE, 3/14/2022 20:53, 65, 0.19, 58456
Female, Maroon, Toyota, TRUE, 8/13/2020 02:10, 37, 0.5, 66113
Male, Yellow, Volvo, TRUE, 5/7/2021 18:33, 20, 0.01, 54505
Male, Indigo, Honda, FALSE, 12/5/2021 22:32, 35, 0.35, 22164
Female, Crimson, Mitsubishi, FALSE, 2/10/2019 19:44, 20, 0.43, 59242
Male, Red, Lamborghini, FALSE, 2/3/2018 16:51, 62, 0.25, 52035
Female, Puce, Pontiac, TRUE, 8/25/2022 06:48, 51, , 14850
Female, Red, Mercedes-Benz, TRUE, 8/23/2020 00:22, 49, 0.47, 64182
Female, Red, Subaru, FALSE, 7/2/2022 18:36, 24, 0.07, 46437
Genderqueer, Blue, GMC, TRUE, 8/13/2021 21:12, 28, 0.43, 55222
Genderqueer, Mauv, Acura, TRUE, 8/19/2020 15:00, 48, 0.02, 39445
Male, Teal, Volkswagen, FALSE, 6/24/2019 01:28, 63, 0.33, 62168
Male, Goldenrod, Volvo, TRUE, 6/18/2022 14:29, 49, 0.31, 63975
Genderfluid, Red, Chevrolet, TRUE, 5/10/2020 09:26, 20, 0.36, 61418
Female, Purple, Pontiac, TRUE, 1/19/2020 10:10, 54, 0.26, 22861
Male, Violet, Audi, FALSE, 12/7/2020 03:08, 22, 0.02, 22011
Female, Green, Infiniti, FALSE, 11/19/2019 23:28, 33, 0.47,
Female, Pink, Pontiac, TRUE, 9/27/2020 21:14, 63, 0.47, 17651
Polygender, Teal, Ford, , 8/23/2020 23:57, 56, 0.44, 45723
Female, Turquoise, Cadillac, FALSE, 9/15/2020 23:18, 49, 0.19, 30522
Female, Fuscia, Lincoln, FALSE, 5/30/2022 06:54, 60, 0.07, 46488
Male, Fuscia, Hyundai, , 5/16/2022 09:02, 46, 0.31, 35728
Female, Violet, Subaru, FALSE, 3/1/2020 03:54, 65, 0.35, 27711
Male, Orange, Volvo, FALSE, 4/30/2020 03:50, 50, 0.28, 49530
Female, Mauv, Volvo, FALSE, 12/9/2018 22:06, 55, 0.08, 58668
Female, Green, BMW, TRUE, 7/8/2020 22:02, 27, 0.3, 32802
Male, Crimson, Ferrari, TRUE, 9/19/2018 13:30, 26, 0.33, 40342
Male, Maroon, Ford, FALSE, 9/24/2020 11:26, 65, 0.05, 57742
Female, Maroon, GMC, TRUE, 5/23/2022 05:57, , 0.3, 51489
Female, Goldenrod, Land Rover, FALSE, 2/3/2022 06:32, 45, 0.11, 12598
Male, Indigo, Oldsmobile, FALSE, 8/21/2021 06:09, 29, 0.43, 61847
Female, Turquoise, Toyota, FALSE, 5/24/2022 03:45, 39, , 27765
Male, Violet, Chevrolet, TRUE, 8/20/2020 17:09, 49, 0.17, 36808
Male, Crimson, Chevrolet, FALSE, 10/23/2021 01:20, 20, 0.38, 20840
Male, Maroon, Hummer, FALSE, 10/24/2018 22:03, 42, 0.12, 35452
Female, Crimson, Mercedes-Benz, FALSE, 9/8/2021 16:45, 31, , 36333
Female, Turquoise, Porsche, FALSE, 5/5/2018 20:45, 61, 0.21, 20235
Female, Crimson, Honda, FALSE, 6/9/2022 04:03, 42, 0.24, 59699
Bigender, Indigo, Jaguar, TRUE, 4/23/2018 14:43, 65, 0.1, 19434
Female, Yellow, Mercury, FALSE, 10/8/2018 13:17, 25, 0.5, 48460
Male, Fuscia, Foose, FALSE, 12/23/2022 16:34, 41, 0.37, 24059
Male, Pink, Pontiac, TRUE, 11/23/2020 07:56, 25, 0.5, 15341
Male, Crimson, Mazda, FALSE, 6/9/2022 06:10, 36, 0.14, 12332
Male, Orange, Pontiac, FALSE, 6/21/2018 22:33, 27, 0.03, 29087
Female, Fuscia, Lincoln, FALSE, 10/27/2018 18:25, 65, 0.37, 30411
Male, Maroon, Lexus, FALSE, 10/1/2020 17:33, 58, 0.15, 30966
Male, Red, Volvo, TRUE, 2/17/2022 08:09, 28, 0.12, 31525
Female, Orange, Pontiac, FALSE, 11/29/2021 00:00, 57, 0.37, 72883
Male, Green, GMC, FALSE, 10/22/2019 21:33, 49, 0.06, 33947
Male, Indigo, Nissan, TRUE, 9/2/2020 00:08, 34, 0.08, 40560
Female, Red, Mercedes-Benz, FALSE, 12/13/2020 23:40, 48, 0.46, 72182
Female, Purple, BMW, TRUE, 8/11/2018 07:52, 44, 0.02, 29958
Male, Puce, Kia, FALSE, 7/26/2020 13:15, 30, 0.01, 36059
Male, Purple, Lotus, FALSE, 1/30/2021 13:27, 49, 0.16, 69844
Male, Teal, Mazda, TRUE, 4/11/2021 19:38, 20, 0.38, 16677
Female, Indigo, Pontiac, TRUE, 4/26/2018 19:38, 62, 0.43, 25993
Genderqueer, Fuscia, Honda, FALSE, 12/22/2018 19:01, 35, 0.07, 36281
Male, , Volkswagen, TRUE, 7/28/2022 15:39, 44, 0.03, 23252
Male, Goldenrod, Mazda, TRUE, 7/14/2019 11:13, 45, 0.42, 62763
Male, Fuscia, Toyota, FALSE, 9/9/2021 15:35, 38, 0.13, 55763
Female, Maroon, Dodge, TRUE, 4/10/2021 05:19, 46, 0.47, 35357
Female, Maroon, Mitsubishi, FALSE, 10/29/2019 08:39, 61, 0.42, 33542
Male, Blue, Infiniti, TRUE, 11/20/2022 16:27, 53, 0.07, 72667
Male, Violet, Oldsmobile, FALSE, 10/15/2022 14:13, 27, 0.25, 33804
Male, Blue, Mercedes-Benz, FALSE, 12/4/2019 13:53, 47, 0.06, 41804
Male, Turquoise, Saturn, TRUE, 8/20/2022 21:58, 30, 0.5, 29340
Male, Maroon, Buick, TRUE, 10/25/2020 07:14, 60, 0.48, 17356
Female, Aquamarine, Mercedes-Benz, TRUE, 10/8/2021 18:42, 32, 0.16, 36405
Agender, Mauv, Hyundai, FALSE, 10/6/2020 18:26, 38, 0.09, 42996
Female, Aquamarine, Land Rover, TRUE, 7/13/2022 02:48, 36, 0.37, 72034
Female, Khaki, Spyker, TRUE, 9/17/2020 09:09, 37, 0.49, 62022
Male, Fuscia, Mercury, TRUE, 11/8/2022 06:38, 40, 0.36, 49116
Female, Mauv, Ford, FALSE, 9/13/2019 14:00, 34, 0.32, 52757
Male, Teal, Chrysler, FALSE, 8/13/2020 07:58, 64, 0.04, 17377
